User Input,Chatbot Response,Timestamp
Dhanush,"Gardening tips include choosing the right plants for your climate, watering properly, and using organic fertilizers.",2025-03-11 23:34:13
Dhanush,Growing a vegetable garden allows you to enjoy fresh produce and connect with nature.,2025-03-11 23:34:35
yash,"Gardening tips include choosing the right plants for your climate, watering properly, and using organic fertilizers.",2025-03-11 23:35:45
hi,Nothing much,2025-03-11 23:36:49
hi,Hey,2025-03-11 23:37:19
how are you,I can answer questions and provide assistance,2025-03-11 23:37:32
hi,Hello,2025-03-12 18:07:23
how are you,I am a chatbot,2025-03-12 18:07:43
